{
  "format": "canisend.operation-registry/v4",
  "version": 4,
  "workspace_format": "canisend.workspace/v4",
  "agent_protocol": "canisend.agent/v4",
  "operations": [
    {"id":"workspace.initialize.preview","phase":"preview","context":"host","agent_task":null,"adapters":{"cli":"workspace initialize preview","mcp":"canisend_workspace_initialize_preview","tauri":"workspace_initialize_preview"}},
    {"id":"workspace.initialize.commit","phase":"commit","context":"host","agent_task":null,"adapters":{"cli":"workspace initialize commit","mcp":"canisend_workspace_initialize_commit","tauri":"workspace_initialize_commit"}},
    {"id":"workspace.status","phase":"read","context":"workspace","agent_task":"orientation","adapters":{"cli":"workspace status","mcp":"canisend_workspace_status","tauri":"workspace_status"}},
    {"id":"workspace.check","phase":"read","context":"workspace","agent_task":"recovery","adapters":{"cli":"workspace check","mcp":"canisend_workspace_check","tauri":"workspace_check"}},
    {"id":"workspace.backup.preview","phase":"preview","context":"workspace","agent_task":"recovery","adapters":{"cli":"workspace backup preview","mcp":"canisend_workspace_backup_preview","tauri":"workspace_backup_preview"}},
    {"id":"workspace.backup.commit","phase":"commit","context":"workspace","agent_task":"recovery","adapters":{"cli":"workspace backup commit","mcp":"canisend_workspace_backup_commit","tauri":"workspace_backup_commit"}},
    {"id":"workspace.restore.preview","phase":"preview","context":"workspace","agent_task":"recovery","adapters":{"cli":"workspace restore preview","mcp":"canisend_workspace_restore_preview","tauri":"workspace_restore_preview"}},
    {"id":"workspace.restore.commit","phase":"commit","context":"workspace","agent_task":"recovery","adapters":{"cli":"workspace restore commit","mcp":"canisend_workspace_restore_commit","tauri":"workspace_restore_commit"}},
    {"id":"workspace.repair.preview","phase":"preview","context":"workspace","agent_task":"recovery","adapters":{"cli":"workspace repair preview","mcp":"canisend_workspace_repair_preview","tauri":"workspace_repair_preview"}},
    {"id":"workspace.repair.commit","phase":"commit","context":"workspace","agent_task":"recovery","adapters":{"cli":"workspace repair commit","mcp":"canisend_workspace_repair_commit","tauri":"workspace_repair_commit"}},

    {"id":"application.list","phase":"read","context":"workspace","agent_task":"orientation","adapters":{"cli":"application list","mcp":"canisend_application_list","tauri":"application_list"}},
    {"id":"application.show","phase":"read","context":"application","agent_task":"orientation","adapters":{"cli":"application show","mcp":"canisend_application_show","tauri":"application_show"}},
    {"id":"application.pack.show","phase":"read","context":"application","agent_task":"orientation","adapters":{"cli":"application pack show","mcp":"canisend_application_pack_show","tauri":"application_pack_show"}},
    {"id":"application.create.preview","phase":"preview","context":"workspace","agent_task":"application-create","adapters":{"cli":"application create preview","mcp":"canisend_application_create_preview","tauri":"application_create_preview"}},
    {"id":"application.create.commit","phase":"commit","context":"workspace","agent_task":"application-create","adapters":{"cli":"application create commit","mcp":"canisend_application_create_commit","tauri":"application_create_commit"}},
    {"id":"application.archive.preview","phase":"preview","context":"application","agent_task":null,"adapters":{"cli":"application archive preview","mcp":"canisend_application_archive_preview","tauri":"application_archive_preview"}},
    {"id":"application.archive.commit","phase":"commit","context":"application","agent_task":null,"adapters":{"cli":"application archive commit","mcp":"canisend_application_archive_commit","tauri":"application_archive_commit"}},

    {"id":"profile.show","phase":"read","context":"workspace","agent_task":"profile-evidence","adapters":{"cli":"profile show","mcp":"canisend_profile_show","tauri":"profile_show"}},
    {"id":"profile.update.preview","phase":"preview","context":"workspace","agent_task":"profile-evidence","adapters":{"cli":"profile update preview","mcp":"canisend_profile_update_preview","tauri":"profile_update_preview"}},
    {"id":"profile.update.commit","phase":"commit","context":"workspace","agent_task":"profile-evidence","adapters":{"cli":"profile update commit","mcp":"canisend_profile_update_commit","tauri":"profile_update_commit"}},
    {"id":"profile.association.list","phase":"read","context":"application","agent_task":"profile-evidence","adapters":{"cli":"profile association list","mcp":"canisend_profile_association_list","tauri":"profile_association_list"}},
    {"id":"profile.association.preview","phase":"preview","context":"application","agent_task":"profile-evidence","adapters":{"cli":"profile association preview","mcp":"canisend_profile_association_preview","tauri":"profile_association_preview"}},
    {"id":"profile.association.commit","phase":"commit","context":"application","agent_task":"profile-evidence","adapters":{"cli":"profile association commit","mcp":"canisend_profile_association_commit","tauri":"profile_association_commit"}},

    {"id":"source.list","phase":"read","context":"application","agent_task":"intake","adapters":{"cli":"source list","mcp":"canisend_source_list","tauri":"source_list"}},
    {"id":"source.show","phase":"read","context":"application","agent_task":"intake","adapters":{"cli":"source show","mcp":"canisend_source_show","tauri":"source_show"}},
    {"id":"source.intake.preview","phase":"preview","context":"application","agent_task":"intake","adapters":{"cli":"source intake preview","mcp":"canisend_source_intake_preview","tauri":"source_intake_preview"}},
    {"id":"source.intake.commit","phase":"commit","context":"application","agent_task":"intake","adapters":{"cli":"source intake commit","mcp":"canisend_source_intake_commit","tauri":"source_intake_commit"}},
    {"id":"source.association.preview","phase":"preview","context":"application","agent_task":"intake","adapters":{"cli":"source association preview","mcp":"canisend_source_association_preview","tauri":"source_association_preview"}},
    {"id":"source.association.commit","phase":"commit","context":"application","agent_task":"intake","adapters":{"cli":"source association commit","mcp":"canisend_source_association_commit","tauri":"source_association_commit"}},

    {"id":"evidence.list","phase":"read","context":"workspace","agent_task":"profile-evidence","adapters":{"cli":"evidence list","mcp":"canisend_evidence_list","tauri":"evidence_list"}},
    {"id":"evidence.show","phase":"read","context":"workspace","agent_task":"profile-evidence","adapters":{"cli":"evidence show","mcp":"canisend_evidence_show","tauri":"evidence_show"}},
    {"id":"evidence.propose.preview","phase":"preview","context":"workspace","agent_task":"profile-evidence","adapters":{"cli":"evidence propose preview","mcp":"canisend_evidence_propose_preview","tauri":"evidence_propose_preview"}},
    {"id":"evidence.propose.commit","phase":"commit","context":"workspace","agent_task":"profile-evidence","adapters":{"cli":"evidence propose commit","mcp":"canisend_evidence_propose_commit","tauri":"evidence_propose_commit"}},
    {"id":"evidence.confirm.preview","phase":"preview","context":"workspace","agent_task":"profile-evidence","adapters":{"cli":"evidence confirm preview","mcp":"canisend_evidence_confirm_preview","tauri":"evidence_confirm_preview"}},
    {"id":"evidence.confirm.commit","phase":"commit","context":"workspace","agent_task":"profile-evidence","adapters":{"cli":"evidence confirm commit","mcp":"canisend_evidence_confirm_commit","tauri":"evidence_confirm_commit"}},
    {"id":"evidence.association.list","phase":"read","context":"application","agent_task":"fit-plan","adapters":{"cli":"evidence association list","mcp":"canisend_evidence_association_list","tauri":"evidence_association_list"}},
    {"id":"evidence.association.preview","phase":"preview","context":"application","agent_task":"fit-plan","adapters":{"cli":"evidence association preview","mcp":"canisend_evidence_association_preview","tauri":"evidence_association_preview"}},
    {"id":"evidence.association.commit","phase":"commit","context":"application","agent_task":"fit-plan","adapters":{"cli":"evidence association commit","mcp":"canisend_evidence_association_commit","tauri":"evidence_association_commit"}},

    {"id":"requirement.list","phase":"read","context":"application","agent_task":"requirements","adapters":{"cli":"requirement list","mcp":"canisend_requirement_list","tauri":"requirement_list"}},
    {"id":"requirement.show","phase":"read","context":"application","agent_task":"requirements","adapters":{"cli":"requirement show","mcp":"canisend_requirement_show","tauri":"requirement_show"}},
    {"id":"requirement.extract.preview","phase":"preview","context":"application","agent_task":"requirements","adapters":{"cli":"requirement extract preview","mcp":"canisend_requirement_extract_preview","tauri":"requirement_extract_preview"}},
    {"id":"requirement.extract.commit","phase":"commit","context":"application","agent_task":"requirements","adapters":{"cli":"requirement extract commit","mcp":"canisend_requirement_extract_commit","tauri":"requirement_extract_commit"}},
    {"id":"requirement.revise.preview","phase":"preview","context":"application","agent_task":"requirements","adapters":{"cli":"requirement revise preview","mcp":"canisend_requirement_revise_preview","tauri":"requirement_revise_preview"}},
    {"id":"source.revise.preview","phase":"preview","context":"application","agent_task":"requirements","adapters":{"cli":"source revise preview","mcp":"canisend_source_revise_preview","tauri":"source_revise_preview"}},